256	Filesystems for Streaming Databases	Kuszmaul, Bradley/MIT CSAIL	2006	2006/txt/07_Kuszmaul_Abstract.txt	http://www.ll.mit.edu/HPEC/agendas/proc06/Day2/07_Kuszmaul_Abstract.pdf
257	Dependable Multiprocessing (DM)	Samson, John R. Jr./Honeywell|Gardner, Gary/Honeywell|Lupia, David/Honeywell|George, Alan D./University of Florida|Patel, Minesh/Tandel Systems, Inc.|Davis, Paul/Tandel Systems, Inc.|Aggarwal, Vikas/Tandel Systems, Inc.|Kalbarczyk, Zbigniew/University of Illinois|Some, Raphael/Jet Propulsion Laboratory	2006	2006/txt/04_Samson_Abstract.txt	http://www.ll.mit.edu/HPEC/agendas/proc06/Day2/04_Samson_Abstract.pdf
258	Experimental Analysis of Multi-FPGA Architectures over RapidIO for Space-Based Radar Processing	Conger, Chris/University of Florida|Bueno, David/University of Florida|George, Alan D./University of Florida	2006	2006/txt/08_Conger_Abstract.txt	http://www.ll.mit.edu/HPEC/agendas/proc06/Day2/08_Conger_Abstract.pdf
259	Radar Digital Beam-Former Utilizing FPGA Based COTS Processors	Fontana, John/Lockheed Martin|Monastra, Edward/Lockheed Martin	2006	2006/txt/09_Fontana_Abstract.txt	http://www.ll.mit.edu/HPEC/agendas/proc06/Day2/09_Fontana_Abstract.pdf
260	An FPGA-Based Dynamic Load-Balancing Processor Architecture for Solving N-body Problems	Phillips, Jonathan/Utah State University|Areno, Matthew/Utah State University|Eames, Brandon/Utah State University|Dasu, Aravind/Utah State University	2006	2006/txt/10_Phillips_Abstract.txt	http://www.ll.mit.edu/HPEC/agendas/proc06/Day2/10_Phillips_Abstract.pdf
261	Hybrid Floating Point Technique Yields 1.2 Gigasample per Second 32 to 2048 point Floating Point FFT in a Single FPGA	Andraka, Raymond/Andraka Consulting Group	2006	2006/txt/11_Andraka_Abstract.txt	http://www.ll.mit.edu/HPEC/agendas/proc06/Day2/11_Andraka_Abstract.pdf
262	FPGA Technology Meets the Multicomputer Environment  Improving Processing Performance and Bandwidth in Advanced Naval Radar Missions	Leeper, Sarah/Mercury Computer Systems, Inc.|Iaquinto, Mike/Lockheed Martin|Brooks, Richard/Mercury Computer Systems, Inc.|Finnivan, Joseph/Mercury Computer Systems, Inc.	2006	2006/txt/12_Leeper_Abstract.txt	http://www.ll.mit.edu/HPEC/agendas/proc06/Day2/12_Leeper_Abstract.pdf
263	Design of Path Optimization Algorithm Using COTS Field Programmable Gate Array Hardware and Software Platforms	Harold, Neil/Nallatech|Ostapovich, John/Nallatech|Pancoast, Rick/Lockheed Martin|Russo, Jon C./Lockheed Martin	2006	2006/txt/13_Harold_Abstract.txt	http://www.ll.mit.edu/HPEC/agendas/proc06/Day2/13_Harold_Abstract.pdf
264	Multi-FPGA Based High Performance LU Decomposition	Sudarsanam, Arvind/Utah State University|Young, Seth/Utah State University|Hauser, Thomas/Utah State University|Dasu, Aravind/Utah State University	2006	2006/txt/14_Dasu_Abstract.txt	http://www.ll.mit.edu/HPEC/agendas/proc06/Day2/14_Dasu_Abstract.pdf
265	Improving the Performance of Parallel Backprojection on a Reconfigurable Supercomputer	Cordes, Benjamin/Northeastern University|Leeser, Miriam E./Northeastern University|Miller, Eric/Northeastern University|Linderman, Richard/AFRL	2006	2006/txt/15_Cordes_Abstract.txt	http://www.ll.mit.edu/HPEC/agendas/proc06/Day2/15_Cordes_Abstract.pdf
266	A New Class of High Performance FFTs	Nash, Greg/Centar	2006	2006/txt/16_Nash_Abstract.txt	http://www.ll.mit.edu/HPEC/agendas/proc06/Day2/16_Nash_Abstract.pdf
267	Running Simulink-Based Designs on SRC-6	Meixner, David/National Center for Supercomputing Applications at Univ. of IllinoisUrbana-Champaign|Kindratenko, Volodymyr/National Center for Supercomputing Applications at Univ. of IllinoisUrbana-Champaign|Pointer, David/National Center for Supercomputing Applications at Univ. of IllinoisUrbana-Champaign	2006	2006/txt/17_Meixner_Abstract.txt	http://www.ll.mit.edu/HPEC/agendas/proc06/Day2/17_Meixner_Abstract.pdf
268	High Performance Low Density Parity Check and Turbo Decoding FPGA Implementation	Shoup, Ryan/MIT Lincoln Laboratory	2006	2006/txt/18_Shoup_Abstract.txt	http://www.ll.mit.edu/HPEC/agendas/proc06/Day2/18_Shoup_Abstract.pdf
269	Close-to-Concept Coding for Configurable Computing	Spaanenburg, Henk/Advanced Principles Group|Thompson, Joe/Advanced Principles Group	2006	2006/txt/19_Spaanenburg_Abstract.txt	http://www.ll.mit.edu/HPEC/agendas/proc06/Day2/19_Spaanenburg_Abstract.pdf
270	CEARCH: Cognition Enabled Architecture	Crago, Stephen P./University of Southern CaliforniaISI|McMahon, Janice/University of Southern CaliforniaISI	2006	2006/txt/20_Crago_Abstract.txt	http://www.ll.mit.edu/HPEC/agendas/proc06/Day2/20_Crago_Abstract.pdf
271	HPEC Challenge SAR Benchmark pMatlab Implementation and Performance	Mullen, Julie/MIT Lincoln Laboratory|Meuse, Theresa/MIT Lincoln Laboratory|Kepner, Jeremy/MIT Lincoln Laboratory	2006	2006/txt/23_Mullen_Abstract.txt	http://www.ll.mit.edu/HPEC/agendas/proc06/Day2/23_Mullen_Abstract.pdf
272	R-Stream: A Parametric High Level Compiler	Schweitz, Eric/Reservoir Laboratories|Lethin, Richard/Reservoir Laboratories|Leung, Allen/Reservoir Laboratories|Meister, Benoit/Reservoir Laboratories	2006	2006/txt/21_Schweitz_Abstract.txt	http://www.ll.mit.edu/HPEC/agendas/proc06/Day2/21_Schweitz_Abstract.pdf
273	Applying Advanced Computing to Improve High-Fidelity Radar Data Simulations	Hulbert, Christopher/Information Systems Laboratory|Bergin, Jameson/Information Systems Laboratory|Techau, Paul/Information Systems Laboratory	2006	2006/txt/24_Hulbert_Abstract.txt	http://www.ll.mit.edu/HPEC/agendas/proc06/Day2/24_Hulbert_Abstract.pdf
274	COGENT: An Innovative Architecture for Cognitive Processing	Bogdanowicz, Julius/Raytheon|Granacki, John/University of Southern CaliforniaISI	2006	2006/txt/22_Bogdanowicz_Abstract.txt	http://www.ll.mit.edu/HPEC/agendas/proc06/Day2/22_Bogdanowicz_Abstract.pdf
275	Interactive Supercomputings Star-P Platform: Parallel MATLAB and MPI Homework Classroom Study on High Level Language Productivity	Edelman, Alan/MIT & Interactive Supercomputing|Husbands, Parry/Interactive Supercomputing & Lawrence  Berkeley National Laboratory|Leibman, Steve/Interactive Supercomputing	2006	2006/txt/25_Edelman_Abstract.txt	http://www.ll.mit.edu/HPEC/agendas/proc06/Day2/25_Edelman_Abstract.pdf
276	Performance Benchmarks and Programmability of the IBM/Sony/Toshiba Cell Broadband Engine Processor	Cico, Luke/Mercury Computer Systems, Inc.|Cooper, Robert/Mercury Computer Systems, Inc.|Greene, Jonathan/Mercury Computer Systems, Inc.|Pepe, Michael/Mercury Computer Systems, Inc.	2006	2006/txt/05_Cico_Abstract.txt	http://www.ll.mit.edu/HPEC/agendas/proc06/Day3/05_Cico_Abstract.pdf
277	Leveraging Multicomputer Frameworks for Use in Multi-Core Processors	Steinsaltz, Yael/Mercury Computer Systems, Inc.|Geaghan, Scott/Mercury Computer Systems, Inc.|Prelle, Myra Jean/Mercury Computer Systems, Inc.|Bouzas, Brian/Mercury Computer Systems, Inc.	2006	2006/txt/05a_Steinsaltz_Abstract.txt	http://www.ll.mit.edu/HPEC/agendas/proc06/Day3/05a_Steinsaltz_Abstract.pdf
278	Speech Recognition on Cell Broadband Engine	Jones, Holger/Lawrence Livermore National Laboratory|Perrone, Michael/IBM Watson Research Center|Liu, Yang/Lawrence Livermore National Laboratory	2006	2006/txt/06_Liu_Abstract.txt	http://www.ll.mit.edu/HPEC/agendas/proc06/Day3/06_Liu_Abstract.pdf
279	The HPEC Challenge Benchmark Suite	Haney, Ryan/MIT Lincoln Laboratory|Meuse, Theresa/MIT Lincoln Laboratory|Kepner, Jeremy/MIT Lincoln Laboratory	2006	2006/txt/03_Haney_Abstract.txt	http://www.ll.mit.edu/HPEC/agendas/proc06/Day3/03_Haney_Abstract.pdf
280	Data Reorganization Interface (DRI): Past Perspective, Future Vision, New Results, and Increased Availability	Cain, Kenneth Jr./Mercury Computer Systems, Inc.	2006	2006/txt/04_Cain_Abstract.txt	http://www.ll.mit.edu/HPEC/agendas/proc06/Day3/04_Cain_Abstract.pdf
281	Computational Requirements of a Non-combinatorial Detection of Multiple Targets in High GMTI Clutter	Streltsov, Simon/LongShortWay, Inc.|Muchnik, Ilya/LongShortWay, Inc.|Petrov, Sergey/LongShortWay, Inc.|Perlovsky, Leonid/AFRL|Deming, Ross/Anteon Corporation	2006	2006/txt/07_Streltsov_Abstract.txt	http://www.ll.mit.edu/HPEC/agendas/proc06/Day3/07_Streltsov_Abstract.pdf
282	Extending the VSIPL Standard to Other Precisions: Gaining the Full Performance of Current Processors	Garrett, Albert/Verari Systems|Skjellum, Anthony/Verari Systems	2006	2006/txt/08_Garrett_Abstract.txt	http://www.ll.mit.edu/HPEC/agendas/proc06/Day3/08_Garrett_Abstract.pdf
283	A Comparison of VSIPL++ Performance to VSIPL and Mercury SAL	Steck, Thomas/Lockheed Martin	2006	2006/txt/09_Steck_Abstract.txt	http://www.ll.mit.edu/HPEC/agendas/proc06/Day3/09_Steck_Abstract.pdf
284	Reusing Verification Components in System-Level Modeling Environments	Sarkar, Ambar/Paradigm Works|Crocker, Jim/Paradigm Works|Ionta, Bob/The MathWorks, Inc.	2006	2006/txt/10_Sarkar_Abstract.txt	http://www.ll.mit.edu/HPEC/agendas/proc06/Day3/10_Sarkar_Abstract.pdf
285	Abstract Machines for RASCs and Signal/Image Processing	Mullin, Lenore/College of Computing and Information at SUNYAlbany|Raynolds, James/College of Nanoscale Science and Engineering at SUNYAlbany|Grout, Ian/University of Limerick|Li, Qiang/College of Computing and Information at SUNYAlbany|Ryan, Jeffrey/University of Limerick	2006	2006/txt/11_Mullin_Abstract.txt	http://www.ll.mit.edu/HPEC/agendas/proc06/Day3/11_Mullin_Abstract.pdf
286	The Measure Polytope: Low Latency and High Bandwidth on Commodity Interconnects	Keville, Kurt/MIT|Vickery, Dan/MIT	2006	2006/txt/12_Keville_Abstract.txt	http://www.ll.mit.edu/HPEC/agendas/proc06/Day3/12_Keville_Abstract.pdf
287	DIFdoc: A Standard Format for Visualizing Hierarchical Dataflow Representations	Corretjer, Ivan/University of Maryland|Bhattacharyya, Shuvra/University of Maryland	2006	2006/txt/13_Corretjer_Abstract.txt	http://www.ll.mit.edu/HPEC/agendas/proc06/Day3/13_Corretjer_Abstract.pdf
288	The Impact of Programming Difficulty on Hardware Obsolescence	Steed, James/Gedae|Lundgren, William/Gedae|Barnes, Kerry/Gedae	2006	2006/txt/14_Steed_Abstract.txt	http://www.ll.mit.edu/HPEC/agendas/proc06/Day3/14_Steed_Abstract.pdf
289	X-Sim: A Federated Heterogeneous Simulation Environment	Chamberlain, Roger/Washington University|Gayen, Saurabh/Washington University|Tyson, Eric/Washington University|Franklin, Mark/Washington University|Crowley, Patrick/Washington University	2006	2006/txt/15_Chamberlain_Abstract.txt	http://www.ll.mit.edu/HPEC/agendas/proc06/Day3/15_Chamberlain_Abstract.pdf
290	System Overhead Management with Virtual Power Centers for Biometric Applications	Howard, Kevin/Massively Parallel Technologies|Lupo, James/Massively Parallel Technologies	2006	2006/txt/16_Howard_Abstract.txt	http://www.ll.mit.edu/HPEC/agendas/proc06/Day3/16_Howard_Abstract.pdf
291	Modeling Concurrency in NOC for Embedded Systems	Agarwal, Ankur/Florida Atlantic University|Shankar, Ravi/Florida Atlantic University	2006	2006/txt/17_Agarwal_Abstract.txt	http://www.ll.mit.edu/HPEC/agendas/proc06/Day3/17_Agarwal_Abstract.pdf
292	Algorithm Development for Future High Performance Systems Jigsaw: An Early Case Study	Khan, Imran/SoftServ International	2006	2006/txt/18_Khan_Abstract.txt	http://www.ll.mit.edu/HPEC/agendas/proc06/Day3/18_Khan_Abstract.pdf
293	Software Decomposition for Multicore Architectures	Jain, Ankit/Florida Atlantic University|Shankar, Ravi/Florida Atlantic University	2006	2006/txt/19_Jain_Abstract.txt	http://www.ll.mit.edu/HPEC/agendas/proc06/Day3/19_Jain_Abstract.pdf
294	VSIPL++ Acceleration Using Commodity Graphics Processors	Campbell, Daniel/Georgia Institute of Technology	2006	2006/txt/20_Campbell_Abstract.txt	http://www.ll.mit.edu/HPEC/agendas/proc06/Day3/20_Campbell_Abstract.pdf
295	Enabling Cognitive Architectures for UAV Mission Planning	Russo, Jon C./Lockheed Martin|Amduka, Mohammed/Lockheed Martin|Pedersen, Keith/Lockheed Martin|Lethin, Richard/Reservoir Laboratories|Springer, Jonathan/Reservoir Laboratories|Manohar, Rajit/Cornell University|Melhem, Rami/University of Pittsburgh	2006	2006/txt/21_Russo_Abstract.txt	http://www.ll.mit.edu/HPEC/agendas/proc06/Day3/21_Russo_Abstract.pdf
296	Spaceborne Processor Array in Multifunctional Structure (SPAMS)	Chow, Edward/Jet Propulsion Laboratory|Schatzel, Don/Jet Propulsion Laboratory|Whitaker, Bill/Jet Propulsion Laboratory|Sterling, Thomas/Louisiana State University	2006	2006/txt/22_Chow_Abstract.txt	http://www.ll.mit.edu/HPEC/agendas/proc06/Day3/22_Chow_Abstract.pdf
297	Exploring the Cell with HPEC Challenge Benchmarks	Sacco, Sharon/MIT Lincoln Laboratory|Schrader, Glenn/MIT Lincoln Laboratory|Kepner, Jeremy/MIT Lincoln Laboratory	2006	2006/txt/23_Sacco_Abstract.txt	http://www.ll.mit.edu/HPEC/agendas/proc06/Day3/23_Sacco_Abstract.pdf
298	The Impact of Multicore on Math Software	Dongarra, Jack/University of Tennessee, ICL	2007	2007/txt/01_Dongarra_Abstract.txt	http://www.ll.mit.edu/HPEC/agendas/proc07/Day1/01_Dongarra_Abstract.pdf
299	Worlds First Polymorphic ComputerMONARCH	Lewins, Lloyd/Raytheon Company|Prager, Kenneth/Raytheon Company|Groves, Gillian/Raytheon Company|Vahey, Michael/Raytheon Company	2007	2007/txt/05_LewinsPrager_Abstract.txt	http://www.ll.mit.edu/HPEC/agendas/proc07/Day1/05_LewinsPrager_Abstract.pdf
300	Advanced Programming and Execution Models for Future Multi-Core Systems	Zima, Hans/Jet Propulsion Laboratory, California Institute of Technology; Institute of Scientific Computing, University of Vienna, Austria	2007	2007/txt/06_Zima_Abstract.txt	http://www.ll.mit.edu/HPEC/agendas/proc07/Day1/06_Zima_Abstract.pdf
301	ALPS: Software Framework for Scheduling Parallel Computations with Application to Parallel Space-Time Adaptive Processing	Lee, Kyusoon/Cornell University|Bojanczyk, Adam/Cornell University	2007	2007/txt/07_Lee_Abstract.txt	http://www.ll.mit.edu/HPEC/agendas/proc07/Day1/07_Lee_Abstract.pdf
302	A Clustered Multiprocessor and Its Multicore Building Block	Reilly, Matthew/SiCortex, Inc.	2007	2007/txt/08_Reilly_Abstract.txt	http://www.ll.mit.edu/HPEC/agendas/proc07/Day1/08_Reilly_Abstract.pdf
303	NMP ST8 Dependable Multiprocessor	Samson, John R. Jr./Honeywell International|George, Alan D./University of Florida|Some, Raphael/Jet Propulsion Laboratory, California Institute of Technology	2007	2007/txt/09_Samson_Abstract.txt	http://www.ll.mit.edu/HPEC/agendas/proc07/Day1/09_Samson_Abstract.pdf
304	DMAGIC: A High-level Partitioning Methodology for Discrete Signal Transforms onto Distributed Hardware Architectures	Arce-Nazario, Rafael/University of Puerto Rico, Mayagez|Jimenez, Manuel/University of Puerto Rico, Mayagez|Rodriguez, Domingo/University of Puerto Rico, Mayagez	2007	2007/txt/10_Arce_Nazario_Abstract.txt	http://www.ll.mit.edu/HPEC/agendas/proc07/Day1/10_Arce_Nazario_Abstract.pdf
305	Terabyte ToKuSampleSort	Kuszmaul, Bradley/Massachusetts Institute of Technology CSAIL, Tokutek, Inc., Clik Arts Inc., and MIT Lincoln Laboratory	2007	2007/txt/11_Kuszmaul_Abstract.txt	http://www.ll.mit.edu/HPEC/agendas/proc07/Day1/11_Kuszmaul_Abstract.pdf
306	Use of Dense Wavelength Division Multiplexing (DWDM) Optical Interconnects to Improve Parallel and Distributed Processing Architecture Connectivity	Stevens, Rick/Lockheed Martin Corporation|Whaley, Greg/Lockheed Martin Corporation|Karnopp, Roger/Lockheed Martin Corporation|Schantz, Howard/Lockheed Martin Corporation|Horne, Mert/Lockheed Martin Corporation	2007	2007/txt/12_Stevens_Abstract.txt	http://www.ll.mit.edu/HPEC/agendas/proc07/Day1/12_Stevens_Abstract.pdf
307	Performance of Direct Attached Disk Subsystems	Chamberlain, Roger/Washington University in St. Louis and Exegy, Inc.|Shands, Berkley/Washington University in St. Louis	2007	2007/txt/13_Chamberlain_Abstract.txt	http://www.ll.mit.edu/HPEC/agendas/proc07/Day1/13_Chamberlain_Abstract.pdf
308	Low Latency Real-Time Computing on Multiprocessor Systems Running Standard Linux	Sivanich, Dimitri/SGI	2007	2007/txt/15_Sivanich_Abstract.txt	http://www.ll.mit.edu/HPEC/agendas/proc07/Day1/15_Sivanich_Abstract.pdf
309	Optimization of Memory Allocation in VSIPL	Suh, Jinwoo/University of Southern California, ISI|McMahon, Janice/University of Southern California, ISI|Crago, Stephen P./University of Southern California, ISI|Kang, Dong-In/University of Southern California, ISI	2007	2007/txt/16_Suh_Abstract.txt	http://www.ll.mit.edu/HPEC/agendas/proc07/Day1/16_Suh_Abstract.pdf
310	Use of Python as a Matlab Replacement for Algorithm Development and Execution in a Multi-Core Environment	Mabey, Glen/Southwest Research Institute|Granger, Brian/Tech-X Corporation	2007	2007/txt/17_Mabey_Abstract.txt	http://www.ll.mit.edu/HPEC/agendas/proc07/Day1/17_Mabey_Abstract.pdf
311	Automatic Deployment of Streaming Applications on Hybrid Architectures	Chamberlain, Roger/Washington University in St. Louis|Franklin, Mark/Washington University in St. Louis	2007	2007/txt/18_Chamberlain_Abstract.txt	http://www.ll.mit.edu/HPEC/agendas/proc07/Day1/18_Chamberlain_Abstract.pdf
312	Multiprocessor Implementation of a Face Detection System	Saha, Sankalita/University of Maryland, College Park|Bambha, Neal/US Army Research Laboratory|Bhattacharyya, Shuvra/University of Maryland, College Park	2007	2007/txt/21_Bhattacharyya_Abstract.txt	http://www.ll.mit.edu/HPEC/agendas/proc07/Day1/21_Bhattacharyya_Abstract.pdf
313	Synthesizing Parallel Programming Models for Asymmetric Multi-core Systems	Nikolopoulos, Dimitris/Virginia Tech|Cameron, Kirk/Virginia Tech	2007	2007/txt/19_Nikolopoulos_Abstract.txt	http://www.ll.mit.edu/HPEC/agendas/proc07/Day1/19_Nikolopoulos_Abstract.pdf
314	Benchmarking Publish/Subscribe Middleware for Radar Applications	Rhoades, Andrew/MIT Lincoln Laboratory|Schrader, Glenn/MIT Lincoln Laboratory|Poulin, Paul/MIT Lincoln Laboratory	2007	2007/txt/20_Rhoades_Abstract.txt	http://www.ll.mit.edu/HPEC/agendas/proc07/Day1/20_Rhoades_Abstract.pdf
315	TX-2500An Interactive, On-Demand Rapid-Prototyping HPC System	Reuther, Albert/MIT Lincoln Laboratory|Arcand, William/MIT Lincoln Laboratory|Currie, Tim/MIT Lincoln Laboratory|Funk, Andrew/MIT Lincoln Laboratory|Kepner, Jeremy/MIT Lincoln Laboratory|Hubbell, Matthew/MIT Lincoln Laboratory|McCabe, Andrew/MIT Lincoln Laboratory|Michaleas, Peter/MIT Lincoln Laboratory	2007	2007/txt/22_Reuther_Abstract.txt	http://www.ll.mit.edu/HPEC/agendas/proc07/Day1/22_Reuther_Abstract.pdf
316	Thimble: Design-time Analysis of Multi-threaded System Behavior	Waddington, Daniel/Lockheed Martin Corporation	2007	2007/txt/23_Waddington_Abstract.txt	http://www.ll.mit.edu/HPEC/agendas/proc07/Day1/23_Waddington_Abstract.pdf
317	Preliminary Study toward Intelligent Run-time Resource Management Techniques for Large Tiled Multi-Core Architectures	Kang, Dong-In/University of Southern California, ISI|Suh, Jinwoo/University of Southern California, ISI|McMahon, Janice/University of Southern California, ISI|Crago, Stephen P./University of Southern California, ISI	2007	2007/txt/24_Kang_Abstract.txt	http://www.ll.mit.edu/HPEC/agendas/proc07/Day1/24_Kang_Abstract.pdf
318	HPC Processor Trends from High-end to Volume, Small, Large, Open, or Embedded	Scott, David/Intel Corporation	2007	2007/txt/25_Scott_Wheat_Abstract.txt	http://www.ll.mit.edu/HPEC/agendas/proc07/Day1/25_Scott_Wheat_Abstract.pdf
319	Beyond Multi-core: The Dawning of the Era of Tera, Intel 80-core Tera-scale Research Processor	Held, James/Intel Corporation	2007	2007/txt/03_Held_Abstract.txt	http://www.ll.mit.edu/HPEC/agendas/proc07/Day2/03_Held_Abstract.pdf
320	Using Industry Standards to Exploit the Advantages and Resolve the Challenges of Multicore Technology	Levy, Markus/The Multicore Association and The Embedded Microprocessor Benchmark Consortium	2007	2007/txt/04_Levy_Abstract.txt	http://www.ll.mit.edu/HPEC/agendas/proc07/Day2/04_Levy_Abstract.pdf
321	High Performance Parallel Implementation of Adaptive Beamforming Using Sinusoidal Dithers	Vouras, Peter/The Johns Hopkins University|Tran, Trac/The Johns Hopkins University	2007	2007/txt/06_Vouras_Abstract.txt	http://www.ll.mit.edu/HPEC/agendas/proc07/Day2/06_Vouras_Abstract.pdf
322	FFTC: Fastest Fourier Transform for the IBM Cell Broadband Engine	Bader, David A./Georgia Institute of Technology|Agarwal, Virat/Georgia Institute of Technology	2007	2007/txt/08_Bader_Abstract.txt	http://www.ll.mit.edu/HPEC/agendas/proc07/Day2/08_Bader_Abstract.pdf
323	Performance of a Multicore Matrix Multiplication Library	Lauginiger, Frank/Mercury Computer Systems, Inc.|Cooper, Robert/Mercury Computer Systems, Inc.|Greene, Jonathan/Mercury Computer Systems, Inc.|Pepe, Michael/Mercury Computer Systems, Inc.|Prelle, Myra Jean/Mercury Computer Systems, Inc.	2007	2007/txt/09_Lauginiger_Abstract.txt	http://www.ll.mit.edu/HPEC/agendas/proc07/Day2/09_Lauginiger_Abstract.pdf
324	Amenability of Multigrid Computations to FPGA-Based Acceleration	Gu, Yongfeng/Boston University|Herbordt, Martin C./Boston University	2007	2007/txt/05_Gu_Abstract.txt	http://www.ll.mit.edu/HPEC/agendas/proc07/Day2/05_Gu_Abstract.pdf
325	Evaluating Partial Reconfiguration for Embedded FPGA Applications	Hymel, Ross/University of Florida|George, Alan D./University of Florida|Conger, Chris/University of Florida|Lam, Herman/University of Florida	2007	2007/txt/10_Hymel_Conger_Abstract.txt	http://www.ll.mit.edu/HPEC/agendas/proc07/Day2/10_Hymel Conger_Abstract.pdf
326	A Streaming FFT on 3GSPS ADC Data using Core Libraries and DIME-C	Bruce, Robin/Institute of System Level Integration, Alba Centre|Devlin, Malachy/Nallatech	2007	2007/txt/11_Bruce_Abstract.txt	http://www.ll.mit.edu/HPEC/agendas/proc07/Day2/11_Bruce_Abstract.pdf
327	Accelerating Algorithm Implementation in FPGA/ASIC Using Python	Dillon, Tom/Dillon Engineering, Inc.|Paatela, Jeremy/Dillon Engineering, Inc.|Dannoritzer, Guenter/Dillon Engineering, Inc.|Hussong, Scott/Dillon Engineering, Inc.	2007	2007/txt/12_Dillon_Abstract.txt	http://www.ll.mit.edu/HPEC/agendas/proc07/Day2/12_Dillon_Abstract.pdf
328	Phase Unwrapping on Reconfigurable Hardware	Braganza, Sherman/Northeastern University|Leeser, Miriam E./Northeastern University	2007	2007/txt/13_Braganza_Abstract.txt	http://www.ll.mit.edu/HPEC/agendas/proc07/Day2/13_Braganza_Abstract.pdf
329	SmartCell: A Coarse-Grained Reconfigurable Architecture for High Performance and Low Power Embedded Computing	Huang, Xinming/Worcester Polytechnic Institute	2007	2007/txt/14_Huang_Abstract.txt	http://www.ll.mit.edu/HPEC/agendas/proc07/Day2/14_Huang_Abstract.pdf
330	Accelerating Genome Sequencing 100X with FPGAs	Storaasli, Olaf/Oak Ridge National Laboratory	2007	2007/txt/15_Storaasli_Abstract.txt	http://www.ll.mit.edu/HPEC/agendas/proc07/Day2/15_Storaasli_Abstract.pdf
331	Prototyping Advanced Military Sensor Systems Using FPGA-to-ASIC Design Flow	Kenny, J. Ryan/Altera Corporation|Wills, Jeff/Altera Corporation|Pancoast, Rick/Lockheed Martin Corporation|Taliaferro, Ellis/Lockheed Martin Corporation	2007	2007/txt/16_Kenny_Abstract.txt	http://www.ll.mit.edu/HPEC/agendas/proc07/Day2/16_Kenny_Abstract.pdf
332	Digital Beam Former Coefficient Management Using Advanced Embedded Processor Technology	Kenny, J. Ryan/Altera Corporation|Krikelis, Argy/Altera Corporation	2007	2007/txt/17_Kenny_Abstract.txt	http://www.ll.mit.edu/HPEC/agendas/proc07/Day2/17_Kenny_Abstract.pdf
333	FPGA Coprocessing in Multi-Core Architectures for DSP	Kenny, J. Ryan/Altera Corporation|Mackin, Bryce/Altera Corporation	2007	2007/txt/18_Kenny_Abstract.txt	http://www.ll.mit.edu/HPEC/agendas/proc07/Day2/18_Kenny_Abstract.pdf
334	Transformation of Sequential Software into Parallel FPGA Hardware: A Case Study Using the SPEC CPU 2006 Benchmark	Hoare, Raymond R./Concurrent EDA, LLC	2007	2007/txt/19_Hoare_Abstract.txt	http://www.ll.mit.edu/HPEC/agendas/proc07/Day2/19_Hoare_Abstract.pdf
335	FPGA-Based Acceleration of an Image Registration Algorithm	Brockman, Jay B./University of Notre Dame|Rinzler, Daniel/University of Notre Dame|Bui, Peter/University of Notre Dame|Iannarilli, Frank/Aerodyne Research, Inc.	2007	2007/txt/20_Brockman_Abstract.txt	http://www.ll.mit.edu/HPEC/agendas/proc07/Day2/20_Brockman_Abstract.pdf
336	Applying Open Standards to FPGA IP Interfaces	Siegel, Shepard/Mercury Computer Systems, Inc.	2007	2007/txt/21_Siegel_Abstract.txt	http://www.ll.mit.edu/HPEC/agendas/proc07/Day2/21_Siegel_Abstract.pdf
337	FPGA Based Systolic Array Implementation of QR Transformation Using Givens Rotations	Wang, Xiaojun/Northeastern University|Leeser, Miriam E./Northeastern University	2007	2007/txt/22_Wang_Abstract.txt	http://www.ll.mit.edu/HPEC/agendas/proc07/Day2/22_Wang_Abstract.pdf
338	Projective Transform on Cell: A Case Study	Sacco, Sharon/MIT Lincoln Laboratory|Kim, Hahn/MIT Lincoln Laboratory|Mohindra, Sanjeev/MIT Lincoln Laboratory|Boettcher, Peter/MIT Lincoln Laboratory|Bowen, Chris/MIT Lincoln Laboratory|Bliss, Nadya Travinin/MIT Lincoln Laboratory|Schrader, Glenn/MIT Lincoln Laboratory|Kepner, Jeremy/MIT Lincoln Laboratory	2007	2007/txt/23_Sacco_Abstract.txt	http://www.ll.mit.edu/HPEC/agendas/proc07/Day2/23_Sacco_Abstract.pdf
339	Toward Fast Computation of Dense Image Correspondence on the GPU	Duchaineau, Mark/Lawrence Livermore National Laboratory|Cohen, Jonathan/Lawrence Livermore National Laboratory|Vaidya, Sheila/Lawrence Livermore National Laboratory	2007	2007/txt/24_Duchaineau_Abstract.txt	http://www.ll.mit.edu/HPEC/agendas/proc07/Day2/24_Duchaineau_Abstract.pdf
340	Analysis and Mapping of Sparse Matrix Computations	Bliss, Nadya Travinin/MIT Lincoln Laboratory|Mohindra, Sanjeev/MIT Lincoln Laboratory|Aggarwal, Varun/Massachusetts Institute of Technology|OReilly, Una-May/Massachusetts Institute of Technology, CSAIL	2007	2007/txt/25_Bliss_Abstract.txt	http://www.ll.mit.edu/HPEC/agendas/proc07/Day2/25_Bliss_Abstract.pdf
341	Are Graphics Processors the New Supercomputers?	Rubin, Norman/ATI Research	2007	2007/txt/28_Rubin_Abstract.txt	http://www.ll.mit.edu/HPEC/agendas/proc07/Day2/28_Rubin_Abstract.pdf
