735	Program fracture and recombination for efficient automatic code reuse	Amidon, Peter/School for Independent Learners, Los Altos, CA 94022|Davis, Eli/MIT EECS and MIT CSAIL, Cambridge, MA 02139|Sidiroglou-Douskos, Stelios/MIT EECS and MIT CSAIL, Cambridge, MA 02139|Rinard, Martin/MIT EECS and MIT CSAIL, Cambridge, MA 02139	2015	2015/txt/2015_7396314.txt	https://ieeexplore.ieee.org/document/7396314
736	From NoSQL Accumulo to NewSQL Graphulo: Design and utility of graph algorithms inside a BigTable database	Hutchison, Dylan/University of Washington, USA|Kepner, Jeremy/MIT Lincoln Laboratory, USA|Gadepally, Vijay/MIT Lincoln Laboratory, USA|Howe, Bill/University of Washington, USA	2016	2016/txt/2016_7761577.txt	https://ieeexplore.ieee.org/document/7761577
737	Efficient implementation of scatter-gather operations for large scale graph analytics	Kumar, Manoj/IBM Thomas J. Watson Research Center, Yorktown Heights, NY 10598-0218, USA|Serrano, Mauricio/IBM Thomas J. Watson Research Center, Yorktown Heights, NY 10598-0218, USA|Moreira, Jose E./IBM Thomas J. Watson Research Center, Yorktown Heights, NY 10598-0218, USA|Pattnaik, Pratap/IBM Thomas J. Watson Research Center, Yorktown Heights, NY 10598-0218, USA|Horn, W P/IBM Thomas J. Watson Research Center, Yorktown Heights, NY 10598-0218, USA|Jann, Joefon/IBM Thomas J. Watson Research Center, Yorktown Heights, NY 10598-0218, USA|Tanase, Gabriel/IBM Thomas J. Watson Research Center, Yorktown Heights, NY 10598-0218, USA	2016	2016/txt/2016_7761578.txt	https://ieeexplore.ieee.org/document/7761578
738	A sparse multi-dimensional Fast Fourier Transform with stability to noise in the context of image processing and change detection	Letourneau, Pierre-David/Reservoir Labs, USA|Langston, M. Harper/Reservoir Labs, USA|Lethin, Richard/Reservoir Labs, USA	2016	2016/txt/2016_7761579.txt	https://ieeexplore.ieee.org/document/7761579
739	The Open Community Runtime: A runtime system for extreme scale computing	Mattson, Timothy G./Intel Corporation, Hillsboro OR, USA|Cledat, Romain/Intel Corporation, Hillsboro OR, USA|Cav, Vincent/Intel Corporation, Hillsboro OR, USA|Sarkar, Vivek/Rice University, Houston TX, USA|Budimli, Zoran/Rice University, Houston TX, USA|Chatterjee, Sanjay/Rice University, Houston TX, USA|Fryman, Joshua/Intel Corporation, Hillsboro OR, USA|Ganev, Ivan/Intel Corporation, Hillsboro OR, USA|Knauerhase, Robin/Intel Corporation, Hillsboro OR, USA|Lee, Min/Intel Corporation, Hillsboro OR, USA|Meister, Benoit/Reservoir Labs, New York NY, USA|Nickerson, Brian/Intel Corporation, Hillsboro OR, USA|Pepperling, Nick/Intel Corporation, Hillsboro OR, USA|Seshasayee, Bala/Intel Corporation, Hillsboro OR, USA|Tasirlar, Sagnak/Two Sigma Investments, LP, USA|Teller, Justin/Facebook, Menlo Park CA, USA|Vrvilo, Nick/Rice University, Houston TX, USA	2016	2016/txt/2016_7761580.txt	https://ieeexplore.ieee.org/document/7761580
740	Landmark routing for large graphs in fixed-memory environments	Campbell, Newton/Cyber Security, Raytheon BBN Technologies, Columbia, Maryland 21046, USA|Laszlo, Michael J./Department of Computer Science, Nova Southeastern University, Ft. Lauderdale, Florida 33314, USA|Mukherjee, Sumitra/Department of Computer Science, Nova Southeastern University, Ft. Lauderdale, Florida 33314, USA	2016	2016/txt/2016_7761581.txt	https://ieeexplore.ieee.org/document/7761581
741	GPU accelerated, robust method for voxelization of solid objects	Nita, Cosmin/Corporate Technology, Siemens SRL, Romania|Stroia, Iulian/Corporate Technology, Siemens SRL, Romania|Itu, Lucian Mihai/Corporate Technology, Siemens SRL, Romania|Suciu, Constantin/Corporate Technology, Siemens SRL, Romania|Mihalef, Viorel/Medical Imaging Technologies, Siemens Medical Solutions, USA|Datar, Manasi/Medical Imaging Technologies, Siemens Healthcare GmbH, Germany|Rapaka, Saikiran/Medical Imaging Technologies, Siemens Medical Solutions, USA|Sharma, Puneet/Medical Imaging Technologies, Siemens Medical Solutions, USA	2016	2016/txt/2016_7761582.txt	https://ieeexplore.ieee.org/document/7761582
742	Unified and lightweight tasks and conduits: A high level parallel programming framework	Liu, Chao/Northeastern University, USA|Leeser, Miriam E./Northeastern University, USA	2016	2016/txt/2016_7761583.txt	https://ieeexplore.ieee.org/document/7761583
743	BigDAWG polystore query optimization through semantic equivalences	She, Zuohao/Electrical Engineering and Computer Science, Northwestern University, Evanston, IL 60208, USA|Ravishankar, Surabhi/Electrical Engineering and Computer Science, Northwestern University, Evanston, IL 60208, USA|Duggan, Jennie/Electrical Engineering and Computer Science, Northwestern University, Evanston, IL 60208, USA	2016	2016/txt/2016_7761584.txt	https://ieeexplore.ieee.org/document/7761584
744	Integrating real-time and batch processing in a polystore	Meehan, John/Brown University, USA|Zdonik, Stan/Brown University, USA|Tian, Shaobo/Brown University, USA|Tian, Yulong/Brown University, USA|Tatbul, Nesime/Intel Labs & MIT, USA|Dziedzic, Adam/University of Chicago, USA|Elmore, Aaron J./University of Chicago, USA	2016	2016/txt/2016_7761585.txt	https://ieeexplore.ieee.org/document/7761585
745	Parallel motion estimation and GPU-based fast coding unit splitting mechanism for HEVC	Lin, Yih-Chuan/Department of Computer Science and Information Engineering, National Formosa University, Yunlin, Taiwan 63201|Wu, Shang-Che/Department of Computer Science and Information Engineering, National Formosa University, Yunlin, Taiwan 63201	2016	2016/txt/2016_7761586.txt	https://ieeexplore.ieee.org/document/7761586
746	KNN in the Jaccard space	Ouyang, Ming/Department of Computer Science, University of Massachusetts Boston, 02125, USA	2016	2016/txt/2016_7761587.txt	https://ieeexplore.ieee.org/document/7761587
747	In-storage embedded accelerator for sparse pattern processing	Jun, Sang-Woo/MIT Computer Science & Artificial Intelligence Laboratory, USA|Nguyen, Huy Tam/MIT Lincoln Laboratory, USA|Gadepally, Vijay/MIT Lincoln Laboratory, USA|Arvind, /MIT Computer Science & Artificial Intelligence Laboratory, USA	2016	2016/txt/2016_7761588.txt	https://ieeexplore.ieee.org/document/7761588
748	High-throughput ingest of data provenance records into Accumulo	Moyer, Thomas/MIT Lincoln Laboratory, Lexington, MA 02420, USA|Gadepally, Vijay/MIT Lincoln Laboratory, Lexington, MA 02420, USA	2016	2016/txt/2016_7761589.txt	https://ieeexplore.ieee.org/document/7761589
749	A hardware design for in-brain neural spike sorting	Liu, Yinan/Department of Electrical and Computer Engineering, Boston University, MA, USA|Sheng, Jiayi/Department of Electrical and Computer Engineering, Boston University, MA, USA|Herbordt, Martin C./Department of Electrical and Computer Engineering, Boston University, MA, USA	2016	2016/txt/2016_7761590.txt	https://ieeexplore.ieee.org/document/7761590
750	LU, QR, and Cholesky factorizations: Programming model, performance analysis and optimization techniques for the Intel Knights Landing Xeon Phi	Haidar, Azzam/University of Tennessee, Knoxville, 37916, USA|Tomov, Stanimire/University of Tennessee, Knoxville, 37916, USA|Arturov, Konstantin/Intel Corporation, Novosibirsk, Russia|Guney, Murat/Intel Corporation, Hillsboro, OR 97124, USA|Story, Shane/Intel Corporation, Hillsboro, OR 97124, USA|Dongarra, Jack/University of Tennessee, Knoxville, Oak Ridge National Laboratory, USA	2016	2016/txt/2016_7761591.txt	https://ieeexplore.ieee.org/document/7761591
751	Enhancing the performance and robustness of the FEAST eigensolver	Gavin, Brendan/Department of Electrical and Computer Engineering, University of Massachusetts - Amherst, 01003, USA|Polizzi, Eric/Department of Electrical and Computer Engineering, University of Massachusetts - Amherst, 01003, USA	2016	2016/txt/2016_7761592.txt	https://ieeexplore.ieee.org/document/7761592
752	Havens: Explicit reliable memory regions for HPC applications	Hukerikar, Saurabh/Computer Science and Mathematics Division, Oak Ridge National Laboratory, TN, USA|Engelmann, Christian/Computer Science and Mathematics Division, Oak Ridge National Laboratory, TN, USA	2016	2016/txt/2016_7761593.txt	https://ieeexplore.ieee.org/document/7761593
753	Data transformation and migration in polystores	Dziedzic, Adam/Department of Computer Science, The University of Chicago, Illinois, USA|Elmore, Aaron J./Department of Computer Science, The University of Chicago, Illinois, USA|Stonebraker, Michael/CSAIL, Massachusetts Institute of Technology, Cambridge, USA	2016	2016/txt/2016_7761594.txt	https://ieeexplore.ieee.org/document/7761594
754	Polyhedral compilation for energy efficiency	Pradelle, Benoit/Reservoir Labs, USA|Baskaran, Muthu/Reservoir Labs, USA|Henretty, Tom/Reservoir Labs, USA|Meister, Benoit/Reservoir Labs, USA|Konstantinidis, Athanasios/Reservoir Labs, USA|Lethin, Richard/Reservoir Labs, USA	2016	2016/txt/2016_7761595.txt	https://ieeexplore.ieee.org/document/7761595
755	Optimizing communication for a 2D-partitioned scalable BFS	Young, Jeffrey/School of Computer Science, Georgia Institute of Technology, Atlanta, USA|Romera, Julian/Institute of Computer Engineering, Ruprecht-Karls University of Heidelberg, Germany|Hauck, Matthias/Institute of Computer Engineering, Ruprecht-Karls University of Heidelberg, Germany|Frning, Holger/Institute of Computer Engineering, Ruprecht-Karls University of Heidelberg, Germany	2016	2016/txt/2016_7761596.txt	https://ieeexplore.ieee.org/document/7761596
756	Cross-institutional research cyberinfrastructure for data intensive science	Lenhardt, W. Christopher/Renaissance Computing Institute (RENCI), University of North Carolina, Chapel Hill, USA|Conway, Mike/Renaissance Computing Institute (RENCI), University of North Carolina, Chapel Hill, USA|Scott, Erik/Renaissance Computing Institute (RENCI), University of North Carolina, Chapel Hill, USA|Blanton, Brian/Renaissance Computing Institute (RENCI), University of North Carolina, Chapel Hill, USA|Krishnamurthy, Ashok/Renaissance Computing Institute (RENCI), University of North Carolina, Chapel Hill, USA|Hadzikadic, Mirsad/University of North Carolina, Charlotte, USA|Vouk, Mladen/North Carolina State University, USA|Wilson, Alyson/North Carolina State University, USA	2016	2016/txt/2016_7761597.txt	https://ieeexplore.ieee.org/document/7761597
757	Distributed and configurable architecture for neuromorphic applications on heterogeneous cluster	Ahmed, Khadeer/Department of Electrical Engineering and Computer Science, Syracuse University, NY 13244, USA|Qiu, Qinru/Department of Electrical Engineering and Computer Science, Syracuse University, NY 13244, USA|Tamhankar, Mangesh/Intel Corporation, Santa Clara, CA USA	2016	2016/txt/2016_7761598.txt	https://ieeexplore.ieee.org/document/7761598
758	GPU-accelerated charge mapping	Sanaullah, Ahmed/Department of Electrical and Computer Engineering, Boston University, MA, USA|Mojumder, Saiful A./Department of Electrical and Computer Engineering, Boston University, MA, USA|Lewis, Kathleen M./Department of Electrical and Computer Engineering, Boston University, MA, USA|Herbordt, Martin C./Department of Electrical and Computer Engineering, Boston University, MA, USA	2016	2016/txt/2016_7761599.txt	https://ieeexplore.ieee.org/document/7761599
759	High-performance algorithms and data structures to catch elephant flows	Ros-Giralt, Jordi/Reservoir Labs, 632 Broadway Suite 803, New York, 10012, USA|Commike, Alan/Reservoir Labs, 632 Broadway Suite 803, New York, 10012, USA|Lethin, Richard/Reservoir Labs, 632 Broadway Suite 803, New York, 10012, USA|Maji, Sourav/Dept. of Electrical and Computer Eng., University of Virginia Charlottesville, 22904-4743, USA|Veeraraghavan, Malathi/Dept. of Electrical and Computer Eng., University of Virginia Charlottesville, 22904-4743, USA	2016	2016/txt/2016_7761600.txt	https://ieeexplore.ieee.org/document/7761600
760	Adding scalability to Internet of Things gateways using parallel computation of edge device data	Caedo, Janice/Auburn Cyber Research Center, Samuel Ginn College of Engineering, Auburn University, USA|Skjellum, Anthony/Auburn Cyber Research Center, Samuel Ginn College of Engineering, Auburn University, USA	2016	2016/txt/2016_7761601.txt	https://ieeexplore.ieee.org/document/7761601
761	Computational and memory analysis of Tegra SoCs	Milluzzi, Andrew/NSF Center for High-Performance Reconfigurable Computing (CHREC), Department of Electrical and Computer Engineering, University of Florida, Gainesville, 32611, USA|George, Alan D./NSF Center for High-Performance Reconfigurable Computing (CHREC), Department of Electrical and Computer Engineering, University of Florida, Gainesville, 32611, USA|Lam, Herman/NSF Center for High-Performance Reconfigurable Computing (CHREC), Department of Electrical and Computer Engineering, University of Florida, Gainesville, 32611, USA	2016	2016/txt/2016_7761602.txt	https://ieeexplore.ieee.org/document/7761602
762	A framework to integrate MFiX with Trilinos for high fidelity fluidized bed computations	Kotteda, V M Krushnarao/Department of Mechanical Engineering, The University of Texas at El Paso, 500 W University Ave, 79968, USA|Chattopadhyay, Ashesh/Computational Science, The University of Texas at El Paso, 500 W University Ave, 79968, USA|Kumar, Vinod/Department of Mechanical Engineering, The University of Texas at El Paso, 500 W University Ave, 79968, USA|Spotz, William/Sandia National Laboratories, P.O. Box 5800, MS 1320, Albuquerque, NM-87185, USA	2016	2016/txt/2016_7761603.txt	https://ieeexplore.ieee.org/document/7761603
763	Scheduler technologies in support of high performance data analysis	Reuther, Albert/Massachusetts Institute of Technology, USA|Byun, Chansup/Massachusetts Institute of Technology, USA|Arcand, William/Massachusetts Institute of Technology, USA|Bestor, David/Massachusetts Institute of Technology, USA|Bergeron, Bill/Massachusetts Institute of Technology, USA|Hubbell, Matthew/Massachusetts Institute of Technology, USA|Jones, Michael/Massachusetts Institute of Technology, USA|Michaleas, Peter/Massachusetts Institute of Technology, USA|Prout, Andrew/Massachusetts Institute of Technology, USA|Rosa, Antonio/Massachusetts Institute of Technology, USA|Kepner, Jeremy/Massachusetts Institute of Technology, USA	2016	2016/txt/2016_7761604.txt	https://ieeexplore.ieee.org/document/7761604
764	Performance analysis and acceleration of explicit integration for large kinetic networks using batched GPU computations	Haidar, Azzam/University of Tennessee, Knoxville, USA|Brock, Benjamin/University of Tennessee, Knoxville, USA|Tomov, Stanimire/University of Tennessee, Knoxville, USA|Guidry, Michael/University of Tennessee, Knoxville, USA|Billings, Jay Jay/University of Tennessee, Knoxville, USA|Shyles, Daniel/University of Tennessee, Knoxville, USA|Dongarra, Jack/University of Tennessee, Knoxville, USA	2016	2016/txt/2016_7761605.txt	https://ieeexplore.ieee.org/document/7761605
765	On-chip memory efficient data layout for 2D FFT on 3D memory integrated FPGA	Singapura, Shreyas G./Ming Hsieh Department of Electrical Engineering, University of Southern California, Los Angeles, 90089, USA|Kannan, Rajgopal/Ming Hsieh Department of Electrical Engineering, University of Southern California, Los Angeles, 90089, USA|Prasanna, Viktor K./Ming Hsieh Department of Electrical Engineering, University of Southern California, Los Angeles, 90089, USA	2016	2016/txt/2016_7761606.txt	https://ieeexplore.ieee.org/document/7761606
766	Accelerated low-rank updates to tensor decompositions	Baskaran, Muthu/Reservoir Labs, USA|Langston, M. Harper/Reservoir Labs, USA|Ramananandro, Tahina/Reservoir Labs, USA|Bruns-Smith, David/Reservoir Labs, USA|Henretty, Tom/Reservoir Labs, USA|Ezick, James/Reservoir Labs, USA|Lethin, Richard/Reservoir Labs, USA	2016	2016/txt/2016_7761607.txt	https://ieeexplore.ieee.org/document/7761607
767	A scale-free structure for power-law graphs	Veras, Richard M./Department of Electrical and Computer Engineering, Carnegie Mellon University, 5000 Forbes Avenue, Pittsburgh, PA 15213, USA|Low, Tze Meng/Department of Electrical and Computer Engineering, Carnegie Mellon University, 5000 Forbes Avenue, Pittsburgh, PA 15213, USA|Franchetti, Franz/Department of Electrical and Computer Engineering, Carnegie Mellon University, 5000 Forbes Avenue, Pittsburgh, PA 15213, USA	2016	2016/txt/2016_7761608.txt	https://ieeexplore.ieee.org/document/7761608
768	Silicon photonic memory interconnect for many-core architectures	Wen, Ke/Sbastien Rumley and Keren Bergman, Columbia University, New York, USA|Guan, Hang/Sbastien Rumley and Keren Bergman, Columbia University, New York, USA|Calhoun, David M./Sbastien Rumley and Keren Bergman, Columbia University, New York, USA|Donofrio, David/Lawrence Berkeley National Laboratory, 1 Cyclotron Road, California, USA|Shalf, John/Lawrence Berkeley National Laboratory, 1 Cyclotron Road, California, USA	2016	2016/txt/2016_7761609.txt	https://ieeexplore.ieee.org/document/7761609
769	Hypervisor performance analysis for real-time workloads	Tran, Geoffrey Phi C./Information Sciences Institute, University of Southern California, Arlington, VA 22203, USA|Chen, Yu-An/Information Sciences Institute, University of Southern California, Arlington, VA 22203, USA|Kang, Dong-In/Information Sciences Institute, University of Southern California, Arlington, VA 22203, USA|Walters, John Paul/Information Sciences Institute, University of Southern California, Arlington, VA 22203, USA|Crago, Stephen P./Information Sciences Institute, University of Southern California, Arlington, VA 22203, USA	2016	2016/txt/2016_7761610.txt	https://ieeexplore.ieee.org/document/7761610
770	Analyzing heterogeneous computing architectures for ADAS and Mobile Imaging applications	Malewski, Rafal/Graphics Technology Engineering Center, NXP Semiconductors, Mou, Denmark|Levy, Markus/EEMBC, El Dorado Hills, CA, USA|Torelli, Peter/EEMBC, Portland, OR, USA	2016	2016/txt/2016_7761611.txt	https://ieeexplore.ieee.org/document/7761611
771	PERFECT case studies demonstrating order of magnitude reduction in power consumption	Wittenberg, David K./BAE Systems, USA|Kadric, Edin/University of Pennsylvania, USA|DeHon, Andr/University of Pennsylvania, USA|Edwards, Jonathan/BAE Systems, USA|Smith, Jeffrey/BAE Systems, USA|Chiricescu, Silviu/BAE Systems, USA	2016	2016/txt/2016_7761612.txt	https://ieeexplore.ieee.org/document/7761612
772	CUDA implementation of an optimal online Gaussian-Signal-in-Gaussian-Noise detector	Nossenson, Nir/Complex Dynamic Systems and Control Laboratory at Northeastern University, Boston, MA, USA|Jaffe, Ariel J./Department of mathematics and computer science at the Weizmann Institute of Science, Rehovot, Israel	2016	2016/txt/2016_7761613.txt	https://ieeexplore.ieee.org/document/7761613
773	Design space exploration of GPU Accelerated cluster systems for optimal data transfer using PCIe bus	Bhimani, Janki/Northeastern University, USA|Leeser, Miriam E./Northeastern University, USA|Mi, Ningfang/Northeastern University, USA	2016	2016/txt/2016_7761614.txt	https://ieeexplore.ieee.org/document/7761614
774	Systems design of cybersecurity in embedded systems	Vai, Michael/MIT Lincoln Laboratory, 244 Wood Street, Lexington, MA 02420, USA|Whelihan, David/MIT Lincoln Laboratory, 244 Wood Street, Lexington, MA 02420, USA|Evancich, N./Intelligent Automation, Inc., 15400 Calhoun Drive, Rockville, MD 20855, USA|Kwak, K.J./Intelligent Automation, Inc., 15400 Calhoun Drive, Rockville, MD 20855, USA|Li, J./Intelligent Automation, Inc., 15400 Calhoun Drive, Rockville, MD 20855, USA|Britton, M./Alion Science and Technology, 220 Salina Meadows Parkway, Syracuse, NY 13212, USA|Foley, J./Alion Science and Technology, 220 Salina Meadows Parkway, Syracuse, NY 13212, USA|Lynch, M./Alion Science and Technology, 220 Salina Meadows Parkway, Syracuse, NY 13212, USA|Schafer, D./AFRL-RIGA, 525 Brooks Road, Rome, NY 13441, USA|DeMatteis, J./AFRL-RIGA, 525 Brooks Road, Rome, NY 13441, USA	2016	2016/txt/2016_7761615.txt	https://ieeexplore.ieee.org/document/7761615
775	ToQ.jl: A high-level programming language for D-Wave machines based on Julia	O'Malley, Daniel/Computational Earth Science, Los Alamos National Laboratory, NM 87545, USA|Vesselinov, Velimir V./Computational Earth Science, Los Alamos National Laboratory, NM 87545, USA	2016	2016/txt/2016_7761616.txt	https://ieeexplore.ieee.org/document/7761616
776	Benchmarking SciDB data import on HPC systems	Samsi, Siddharth/MIT Lincoln Laboratory, Lexington, MA, USA, USA|Brattain, Laura/MIT Lincoln Laboratory, Lexington, MA, USA|Arcand, William/MIT Lincoln Laboratory, Lexington, MA, USA|Bestor, David/MIT Lincoln Laboratory, Lexington, MA, USA|Bergeron, Bill/MIT Lincoln Laboratory, Lexington, MA, USA|Byun, Chansup/MIT Lincoln Laboratory, Lexington, MA, USA|Gadepally, Vijay/MIT Lincoln Laboratory, Lexington, MA, USA|Hubbell, Matthew/MIT Lincoln Laboratory, Lexington, MA, USA|Jones, Michael/MIT Lincoln Laboratory, Lexington, MA, USA|Klein, Anna/MIT Lincoln Laboratory, Lexington, MA, USA|Michaleas, Peter/MIT Lincoln Laboratory, Lexington, MA, USA|Milechin, Lauren/MIT Lincoln Laboratory, Lexington, MA, USA|Mullen, Julie/MIT Lincoln Laboratory, Lexington, MA, USA|Prout, Andrew/MIT Lincoln Laboratory, Lexington, MA, USA|Rosa, Antonio/MIT Lincoln Laboratory, Lexington, MA, USA|Yee, Charles/MIT Lincoln Laboratory, Lexington, MA, USA|Kepner, Jeremy/MIT Lincoln Laboratory, Lexington, MA, USA|Reuther, Albert/MIT Lincoln Laboratory, Lexington, MA, USA	2016	2016/txt/2016_7761617.txt	https://ieeexplore.ieee.org/document/7761617
777	LLMapReduce: Multi-level map-reduce for high performance data analysis	Byun, Chansup/MIT Lincoln Laboratory, Lexington, MA, U.S.A|Kepner, Jeremy/MIT Lincoln Laboratory, Lexington, MA, U.S.A|Arcand, William/MIT Lincoln Laboratory, Lexington, MA, U.S.A|Bestor, David/MIT Lincoln Laboratory, Lexington, MA, U.S.A|Bergeron, Bill/MIT Lincoln Laboratory, Lexington, MA, U.S.A|Gadepally, Vijay/MIT Lincoln Laboratory, Lexington, MA, U.S.A|Hubbell, Matthew/MIT Lincoln Laboratory, Lexington, MA, U.S.A|Michaleas, Peter/MIT Lincoln Laboratory, Lexington, MA, U.S.A|Mullen, Julie/MIT Lincoln Laboratory, Lexington, MA, U.S.A|Prout, Andrew/MIT Lincoln Laboratory, Lexington, MA, U.S.A|Rosa, Antonio/MIT Lincoln Laboratory, Lexington, MA, U.S.A|Yee, Charles/MIT Lincoln Laboratory, Lexington, MA, U.S.A|Reuther, Albert/MIT Lincoln Laboratory, Lexington, MA, U.S.A	2016	2016/txt/2016_7761618.txt	https://ieeexplore.ieee.org/document/7761618
778	Parameter setting for quantum annealers	Pudenz, Kristen L./Lockheed Martin Aeronautics Fort Worth, Texas, USA	2016	2016/txt/2016_7761619.txt	https://ieeexplore.ieee.org/document/7761619
779	A CUDA implementation of the pagerank pipeline benchmark	Bisson, Mauro/NVIDIA Corporation, Santa Clara, CA 95050, USA|Phillips, Everett/NVIDIA Corporation, Santa Clara, CA 95050, USA|Fatica, Massimiliano/NVIDIA Corporation, Santa Clara, CA 95050, USA	2016	2016/txt/2016_7761620.txt	https://ieeexplore.ieee.org/document/7761620
780	On SDN-based extreme-scale networks	Ghalwash, Haitham/Department of Computer Science and Engineering, University of Connecticut, Storrs, CT06269, USA|Huang, Chun-Hsi/Department of Computer Science and Engineering, University of Connecticut, Storrs, CT06269, USA	2016	2016/txt/2016_7761621.txt	https://ieeexplore.ieee.org/document/7761621
781	cuSTINGER: Supporting dynamic graph algorithms for GPUs	Green, Oded/College of Computing, Georgia Institute of Technology, Atlanta, USA|Bader, David A./College of Computing, Georgia Institute of Technology, Atlanta, USA	2016	2016/txt/2016_7761622.txt	https://ieeexplore.ieee.org/document/7761622
782	Towards parallel implementation of associative inference for cogent confabulation	Li, Zhe/Dept. of Electrical Engineering & Computer Science, Syracuse University, NY 13224, USA|Qiu, Qinru/Dept. of Electrical Engineering & Computer Science, Syracuse University, NY 13224, USA|Tamhankar, Mangesh/Intel Corporation, Santa Clara, CA USA	2016	2016/txt/2016_7761623.txt	https://ieeexplore.ieee.org/document/7761623
783	Advantages to modeling relational data using hypergraphs versus graphs	Wolf, Michael M./Center for Computing Research, Sandia National Laboratories, Albuquerque, NM 87185, USA|Klinvex, Alicia M./Center for Computing Research, Sandia National Laboratories, Albuquerque, NM 87185, USA|Dunlavy, Daniel M./Center for Computing Research, Sandia National Laboratories, Albuquerque, NM 87185, USA	2016	2016/txt/2016_7761624.txt	https://ieeexplore.ieee.org/document/7761624
784	Abstractions considered helpful: A tools architecture for quantum annealers	Booth, Michael/D-Wave Systems, Inc., USA|Dahl, Edward/D-Wave Systems, Inc., USA|Furtney, Mark/D-Wave Systems, Inc., USA|Reinhardt, Steven P./D-Wave Systems, Inc., USA	2016	2016/txt/2016_7761625.txt	https://ieeexplore.ieee.org/document/7761625
785	Julia implementation of the Dynamic Distributed Dimensional Data Model	Chen, Alexander/Massachusetts Institute of Technology, Cambridge, MA, U.S.A.|Edelman, Alan/Massachusetts Institute of Technology, Cambridge, MA, U.S.A.|Kepner, Jeremy/MIT Lincoln Laboratory, Lexington, MA, U.S.A.|Gadepally, Vijay/MIT Lincoln Laboratory, Lexington, MA, U.S.A.|Hutchison, Dylan/University of Washington, Seattle, WA, U.S.A.	2016	2016/txt/2016_7761626.txt	https://ieeexplore.ieee.org/document/7761626
786	Optimizing simulation speed of FPGA model-based synthesis	Caldwell, Jeffrey/Raytheon Company Space and Airborne Systems, 2000 E. El Segundo Blvd., CA 90245, USA|Marr, Bo/Raytheon Company Space and Airborne Systems, 2000 E. El Segundo Blvd., CA 90245, USA|Bloom, David/Raytheon Company Space and Airborne Systems, 2000 E. El Segundo Blvd., CA 90245, USA|Thompson, Dan/Raytheon Company Space and Airborne Systems, 2000 E. El Segundo Blvd., CA 90245, USA	2016	2016/txt/2016_7761627.txt	https://ieeexplore.ieee.org/document/7761627
