492	A 25 GFLOPS/Watt Software Programmable Floating Point Accelerator	Olofsson, Andreas/Adapteva Inc.|Trogan, Roman/Adapteva Inc.|Raikhman, Oleg/Adapteva Inc.	2010	2010/txt/PA06_Olofsson_abstract.txt	http://www.ll.mit.edu/HPEC/agendas/proc10/Day1/PA06_Olofsson_abstract.pdf
493	Large Matrix-Matrix Multiply on PS3 clusters	Fitzgerald, Dennis/ITT|Barnell, Mark/AFRL	2010	2010/txt/PA07_Barnell_abstract.txt	http://www.ll.mit.edu/HPEC/agendas/proc10/Day1/PA07_Barnell_abstract.pdf
494	GeAccKL: Toward a GPU numerical kernels library for geosciences	Richardson, Alan/MIT|Hill, Chris/MIT	2010	2010/txt/PA08_Richardson_abstract.txt	http://www.ll.mit.edu/HPEC/agendas/proc10/Day1/PA08_Richardson_abstract.pdf
495	Motion Saliency Map Generations for Video Data Analysis: Spatio-temporal Signatures in the Array Operations	Hu, Jun/Duke University|Pitsianis, Nikos/Duke University|Sun, Xiaobai/Duke University	2010	2010/txt/PA09_Hu_abstract.txt	http://www.ll.mit.edu/HPEC/agendas/proc10/Day1/PA09_Hu_abstract.pdf
496	Queuing Theory Modeling of a CPU-GPU System	May, Lindsay/Northrop Grumman Corporation|Voigt, Robert/Northrop Grumman Corporation	2010	2010/txt/PA10_May_abstract.txt	http://www.ll.mit.edu/HPEC/agendas/proc10/Day1/PA10_May_abstract.pdf
497	Dense Wavelength Division Multiplexed Interconnects for High Performance Embedded Computing Architectures	Cordes, Aaron/Lockheed Martin|Stevens, Rick/Lockheed Martin	2010	2010/txt/PA11_Cordes_abstract.txt	http://www.ll.mit.edu/HPEC/agendas/proc10/Day1/PA11_Cordes_abstract.pdf
498	A Prototype FPGA Tile for Subthreshold-Optimized CMOS	Grossmann, Peter/Northeastern University|Leeser, Miriam E./Northeastern University	2010	2010/txt/PA12_Grossmann_abstract.txt	http://www.ll.mit.edu/HPEC/agendas/proc10/Day1/PA12_Grossmann_abstract.pdf
499	DR&E LLGrid Portal: Interactive Supercomputing for DoD	Reuther, Albert/MIT Lincoln Laboratory|Arcand, William/MIT Lincoln Laboratory|Byun, Chansup/MIT Lincoln Laboratory|Bergeron, Bill/MIT Lincoln Laboratory|Hubbell, Matthew/MIT Lincoln Laboratory|Kepner, Jeremy/MIT Lincoln Laboratory|McCabe, Andrew/MIT Lincoln Laboratory|Michaleas, Peter/MIT Lincoln Laboratory|Mullen, Julie/MIT Lincoln Laboratory|Prout, Andrew/MIT Lincoln Laboratory	2010	2010/txt/F2_1600_Reuther_abstract.txt	http://www.ll.mit.edu/HPEC/agendas/proc10/Day1/F2_1600_Reuther_abstract.pdf
500	Micro-op Fission: Hyper-threading Without the Hyper-headache	Koutsoyannis, Robert/Carnegie Mellon University|Cartolano, Anthony/Carnegie Mellon University|McFarlin, Daniel/Carnegie Mellon University	2010	2010/txt/S2_1435_McFarlin_abstract.txt	http://www.ll.mit.edu/HPEC/agendas/proc10/Day1/S2_1435_McFarlin_abstract.pdf
501	Performance Migration to Open Solutions: OFED for Embedded Fabrics	Cain, Kenneth Jr./Mercury Computer Systems, Inc.	2010	2010/txt/F2_1630_Cain_abstract.txt	http://www.ll.mit.edu/HPEC/agendas/proc10/Day1/F2_1630_Cain_abstract.pdf
502	Automatic Parallelization and Locality Optimization of Beamforming Algorithms	Hartono, Albert/Reservoir Labs, Inc.|Vasilache, Nicolas/Reservoir Labs, Inc.|Bastoul, Cdric/Reservoir Labs, Inc.|Leung, Allen/Reservoir Labs, Inc.|Meister, Benoit/Reservoir Labs, Inc.|Lethin, Richard/Reservoir Labs, Inc.|Vouras, Peter/Naval Research Laboratory	2010	2010/txt/S2_1505_Hartono_abstract.txt	http://www.ll.mit.edu/HPEC/agendas/proc10/Day1/S2_1505_Hartono_abstract.pdf
503	Large Scale Complex Network Analysis Using the Hybrid Combination of a MapReduce Cluster and a Highly Multithreaded System	Kang, Seunghwa/Georgia Institute of Technology|Bader, David A./Georgia Institute of Technology	2010	2010/txt/F2_1700_Kang_abstract.txt	http://www.ll.mit.edu/HPEC/agendas/proc10/Day1/F2_1700_Kang_abstract.pdf
504	Performance Scalability on Embedded Many-Core Processors	Champigny, Michael/Mercury Computer Systems	2010	2010/txt/S2_1550_Champigny_abstract.txt	http://www.ll.mit.edu/HPEC/agendas/proc10/Day1/S2_1550_Champigny_abstract.pdf
505	CRBLASTER: Benchmarking a Cosmic-Ray Rejection Application on the Tilera 64-core TILE64 Processor	Mighell, Kenneth/National Optical Astronomy Observatory	2010	2010/txt/S2_1620_Mighell_abstract.txt	http://www.ll.mit.edu/HPEC/agendas/proc10/Day1/S2_1620_Mighell_abstract.pdf
506	Toward Mega-Scale Computing with pMatlab	Byun, Chansup/MIT Lincoln Laboratory|Kepner, Jeremy/MIT Lincoln Laboratory|Sachdeva, Vipin/IBM|Jordan, Kirk/IBM	2010	2010/txt/S2_1650_Byun_abstract.txt	http://www.ll.mit.edu/HPEC/agendas/proc10/Day1/S2_1650_Byun_abstract.pdf
507	Adding support for GPUs to PVTOL: The Parallel Vector Tile Optimizing Library	Brock, James/Northeastern University|Leeser, Miriam E./Northeastern University|Niedre, Mark/Northeastern University	2010	2010/txt/F3_0915_Brock_abstract.txt	http://www.ll.mit.edu/HPEC/agendas/proc10/Day2/F3_0915_Brock_abstract.pdf
508	Comparison of Multicore Processors using Sourcery VSIPL++	Moses, Brooks/CodeSourcery, Inc.|McCoy, Don/CodeSourcery, Inc.|Voo, Justin/CodeSourcery, Inc.|Seefeld, Stefan/CodeSourcery, Inc.	2010	2010/txt/HPEC10_Moses.txt	http://www.ll.mit.edu/HPEC/agendas/proc10/Day2/HPEC10_Moses.pdf
509	Adaptable and Efficient Variable Size Template Matching in CUDA	Moore, Nicholas/Northeastern University|Leeser, Miriam E./Northeastern University|Smith-King, Laurie/College of the Holy Cross	2010	2010/txt/F3_1100_Moore_abstract.txt	http://www.ll.mit.edu/HPEC/agendas/proc10/Day2/F3_1100_Moore_abstract.pdf
510	Performance Characterization of the Tile Processor Architecture: Lessons Learned	Clark, Matthew/Honeywell|Grobelny, Eric/Honeywell|Passwater, Jim/Honeywell|White, Andrew/Honeywell	2010	2010/txt/PB01_Clark_abstract.txt	http://www.ll.mit.edu/HPEC/agendas/proc10/Day2/PB01_Clark_abstract.pdf
511	The MIST, a local, secure cloud context and 802.11s testbed	Dempsey, Gregory/USMA|Feher, Ronald/USMA|Gordon, Lindsay/USMA|Keville, Kurt/MIT	2010	2010/txt/PB02_Keville_abstract.txt	http://www.ll.mit.edu/HPEC/agendas/proc10/Day2/PB02_Keville_abstract.pdf
512	Development of a Real-Time Parallel UHF SAR Image Processor	Alexander, Matthew/MIT Lincoln Laboratory|Vai, Michael/MIT Lincoln Laboratory|Emberley, Thomas/MIT Lincoln Laboratory|Mooney, Stephen/MIT Lincoln Laboratory|Rizzari, Joseph/MIT Lincoln Laboratory	2010	2010/txt/PB03_Alexander_abstract.txt	http://www.ll.mit.edu/HPEC/agendas/proc10/Day2/PB03_Alexander_abstract.pdf
513	Automated Software Cache Management	Lundgren, William/Gedae, Inc|Barnes, Kerry/Gedae, Inc|Steed, James/Gedae, Inc	2010	2010/txt/PB04_Lundgren_abstract.txt	http://www.ll.mit.edu/HPEC/agendas/proc10/Day2/PB04_Lundgren_abstract.pdf
514	Dependable Multiprocessor (DM) Implementation for Nano-satellite and CubeSat Applications	Clark, Matthew/Honeywell|Samson, John R. Jr./Honeywell	2010	2010/txt/PB05_Clark-Samson_abstract.txt	http://www.ll.mit.edu/HPEC/agendas/proc10/Day2/PB05_Clark-Samson_abstract.pdf
515	Multicore, Multithreaded, and/or Multi-GPU-Kernel VSIPL Standardization, Implementation, and Programming Impacts: Syntax, Semantics, Models	Skjellum, Anthony/RunTime Computing Solutions, LLC	2010	2010/txt/PB07_Skjellum_abstract.txt	http://www.ll.mit.edu/HPEC/agendas/proc10/Day2/PB07_Skjellum_abstract.pdf
516	Mnemosyne: A Tool for Temporal Memory Access Analysis in HPC Applications	Tarapore, Shahrukh/Lockheed Martin|Burkholder, Matthew/Lockheed Martin	2010	2010/txt/PB08_Tarapore_abstract.txt	http://www.ll.mit.edu/HPEC/agendas/proc10/Day2/PB08_Tarapore_abstract.pdf
517	Improving FFTW Benchmark to Measure Multi-core Processor Performance	Pilaud, William/Curtiss Wright Controls Embedded Computing	2010	2010/txt/PB10_Pilaud_abstract.txt	http://www.ll.mit.edu/HPEC/agendas/proc10/Day2/PB10_Pilaud_abstract.pdf
518	Evaluating the Performance of DVB-S2 Over Asymmetric Heterogeneous Optical to Radio Frequency Satellite Links Using the LLGrid	List, Nancy/MIT Lincoln Laboratory|Royster, Tommy/MIT Lincoln Laboratory|Shoup, Ryan/MIT Lincoln Laboratory	2010	2010/txt/PB11_List_abstract.txt	http://www.ll.mit.edu/HPEC/agendas/proc10/Day2/PB11_List_abstract.pdf
519	3-D Graph Processor	Song, William S./MIT Lincoln Laboratory|Kepner, Jeremy/MIT Lincoln Laboratory|Nguyen, Huy Tam/MIT Lincoln Laboratory|Kramer, Joshua/MIT Lincoln Laboratory|Gleyzer, Vitaliy/MIT Lincoln Laboratory|Mann, James/MIT Lincoln Laboratory|Horst, Albert/MIT Lincoln Laboratory|Retherford, Larry/MIT Lincoln Laboratory|Bond, Robert/MIT Lincoln Laboratory|Bliss, Nadya Travinin/MIT Lincoln Laboratory|Robinson, Eric/MIT Lincoln Laboratory|Mohindra, Sanjeev/MIT Lincoln Laboratory|Mullen, Julie/MIT Lincoln Laboratory	2010	2010/txt/S4_1335_Song_abstract.txt	http://www.ll.mit.edu/HPEC/agendas/proc10/Day2/S4_1335_Song_abstract.pdf
520	Enabling High Performance Embedded Computing through Memory Access via Photonic Interconnects	Hendry, Gilbert/Columbia University|Robinson, Eric/MIT Lincoln Laboratory|Gleyzer, Vitaliy/MIT Lincoln Laboratory|Chan, Johnnie/Columbia University|Carloni, Luca P./Columbia University|Bliss, Nadya Travinin/MIT Lincoln Laboratory|Bergman, Keren/Columbia University	2010	2010/txt/S4_1435_Hendry_abstract.txt	http://www.ll.mit.edu/HPEC/agendas/proc10/Day2/S4_1435_Hendry_abstract.pdf
521	Using Graphics Processors to Accelerate Synthetic Aperture Sonar Imaging via Backpropagation	Campbell, Daniel/Georgia Tech Research Institute|McCans, Mark/Georgia Tech Research Institute|Davis, Mike/Georgia Tech Research Institute|Brinkmann, Mike/Georgia Tech Research Institute	2010	2010/txt/S4_1505_Campbell_abstract-backprop.txt	http://www.ll.mit.edu/HPEC/agendas/proc10/Day2/S4_1505_Campbell_abstract-backprop.pdf
522	A Streaming Sensor Challenge Problem for Ubiquitous High Performance Computing	Campbell, Daniel/Georgia Tech Research Institute|Cook, Daniel/Georgia Tech Research Institute|Mulvaney, Brian/Georgia Tech Research Institute	2011	2011/txt/1025_Campbell_Abstract.txt	http://www.ll.mit.edu/HPEC/agendas/proc11/Day1/Session_1/1025_Campbell_Abstract.pdf
523	A Compiler-based Framework for Automatic Extraction of Software Models for Exascale Hardware/Software Co-Design	Dechev, Damian/Sandia National Laboratories|Dakshinamurthy, Amruth/Sandia National Laboratories	2011	2011/txt/1120_Dechev_Abstract.txt	http://www.ll.mit.edu/HPEC/agendas/proc11/Day1/Session_1/1120_Dechev_Abstract.pdf
524	Implementing a Speech Recognition Algorithm with VSIPL++	Moses, Brooks/Mentor Graphics|McCoy, Don/Mentor Graphics|Voo, Justin/Mentor Graphics|Seefeld, Stefan/Mentor Graphics	2011	2011/txt/1150_Moses_Abstract.txt	http://www.ll.mit.edu/HPEC/agendas/proc11/Day1/Focus_1/1150_Moses_Abstract.pdf
525	Computing Betweenness Centrality for Small World Networks on a GPU	Pande, Pushkar/Georgia Institute of Technology|Bader, David A./Georgia Institute of Technology	2011	2011/txt/A-1_Pande_A.txt	http://www.ll.mit.edu/HPEC/agendas/proc11/Day1/Posters/A-1_Pande_A.pdf
526	Performance of VSIPL Functions and SAR Algorithms on Multiple Generations of Intel Processors	Carlston, Peter/Intel Corporation	2011	2011/txt/A-2_Carlston_A.txt	http://www.ll.mit.edu/HPEC/agendas/proc11/Day1/Posters/A-2_Carlston_A.pdf
527	ARM Cortex-A9 Performance in HPEC Applications	Keville, Kurt/MIT|Boyd, M./MIT|Silva, C. Della/MIT	2011	2011/txt/A-3_Keville_A.txt	http://www.ll.mit.edu/HPEC/agendas/proc11/Day1/Posters/A-3_Keville_A.pdf
528	Implementation of Digital Front End Processing Algorithms with Portability across Multiple Processing Platforms	Holland, John/Northrop Grumman Corporation|Horner, Jeremy/Northrop Grumman Corporation|Kuning, Randy/Northrop Grumman Corporation|Oeffinger, David/Northrop Grumman Corporation	2011	2011/txt/A-4_Holland_A.txt	http://www.ll.mit.edu/HPEC/agendas/proc11/Day1/Posters/A-4_Holland_A.pdf
529	On-Chip Nonlinear Digital Compensation for RF Receiver	Gettings, Karen M. G. V./MIT Lincoln Laboratory|Bolstad, Andrew K./MIT Lincoln Laboratory|Chen, Show-Yah Stuart/MIT Lincoln Laboratory|Miller, Benjamin A./MIT Lincoln Laboratory|Vai, Michael/MIT Lincoln Laboratory	2011	2011/txt/A-5_Gettings_A.txt	http://www.ll.mit.edu/HPEC/agendas/proc11/Day1/Posters/A-5_Gettings_A.pdf
530	Supercomputing with Embedded Efficiency: Electronic Warfare	Marr, Bo/Raytheon Company|Prager, Kenneth/Raytheon Company|Trainoff, Mark/Raytheon Company|Pierce, Brian/Raytheon Company	2011	2011/txt/A-6_Marr_A.txt	http://www.ll.mit.edu/HPEC/agendas/proc11/Day1/Posters/A-6_Marr_A.pdf
531	Case Studies Using the Open Compute Language Specification	Sroka, Brian/The MITRE Corporation	2011	2011/txt/A-7_Sroka_A.txt	http://www.ll.mit.edu/HPEC/agendas/proc11/Day1/Posters/A-7_Sroka_A.pdf
532	FPGA-based Acceleration of Hyperspectral K-Means Clustering	Kusinsky, David A./MIT Lincoln Laboratory|Leeser, Miriam E./Northeastern University	2011	2011/txt/A-8_Kusinsky_A.txt	http://www.ll.mit.edu/HPEC/agendas/proc11/Day1/Posters/A-8_Kusinsky_A.pdf
533	A Lock-Free Concurrent Hash Table Design for Effective Information Storage and Retrieval on Large Data Sets	Dechev, Damian/Sandia National Laboratories|Feldman, Steven/University of Central Florida|LaBorde, Pierre/University of Central Florida	2011	2011/txt/A-9_Feldman_A.txt	http://www.ll.mit.edu/HPEC/agendas/proc11/Day1/Posters/A-9_Feldman_A.pdf
534	Scalable Image Graph Matching and Analysis: A top-down framework for image classification, localization, and 3-D geo-registration	Ni, Karl/MIT Lincoln Laboratory|Sawyer, Scott M./MIT Lincoln Laboratory|Vasile, Alex/MIT Lincoln Laboratory|Bliss, Nadya Travinin/MIT Lincoln Laboratory	2011	2011/txt/1430_Ni_A.txt	http://www.ll.mit.edu/HPEC/agendas/proc11/Day1/Session_2/1430_Ni/1430_Ni_A.pdf
535	SIPHER: Scalable Implementation of Primitives for Homomorphic EncRyption - FPGA implementation using Simulink	Cousins, David Bruce/Raytheon BBN Technologies	2011	2011/txt/1430_Cousins_A.txt	http://www.ll.mit.edu/HPEC/agendas/proc11/Day1/Focus_2/1430_Cousins_A.pdf
536	Modular, Scalable Computing for Systems with Tight SWaP Constraints	Bonato, Michael/Colorado Engineering Inc.|French, David/Colorado Engineering Inc.|Fritz, Jason/Colorado Engineering Inc.|Scally, Larry/Colorado Engineering Inc.	2011	2011/txt/1500_Bonato_A.txt	http://www.ll.mit.edu/HPEC/agendas/proc11/Day1/Focus_2/1500_Bonato_A.pdf
537	TDM Photonic Interconnection Network Using CMOS-Compatible Multilayer Integration	Hendry, Robert/Columbia University|Hendry, Gilbert/Columbia University|Biberman, Aleksandr/Columbia University|Bergman, Keren/Columbia University	2011	2011/txt/1545_Hendry_A.txt	http://www.ll.mit.edu/HPEC/agendas/proc11/Day1/Session_2/1545_Hendry_A.pdf
538	Application Level Optimizations for Energy Efficiency and Thermal Stability	Herbordt, Martin C./Boston University|Khan, Ashfaquzzaman/Boston University|Hankendi, Can/Boston University|Coskun, Ayse Kivilcim/Boston University	2011	2011/txt/1615_Herbordt_A.txt	http://www.ll.mit.edu/HPEC/agendas/proc11/Day1/Focus_2/1615_Herbordt_A.pdf
539	An FPGA Spectrum Sensing Accelerator for Cognitive Radio	Eichinger, George III/MIT Lincoln Laboratory|Leeser, Miriam E./Northeastern University|Chowdhury, Kaushik/Northeastern University	2011	2011/txt/1615_Eichinger_A.txt	http://www.ll.mit.edu/HPEC/agendas/proc11/Day1/Session_2/1615_Eichinger_A.pdf
540	Accelerating Bit Error Rate Simulation in MATLAB with Graphics Processors	Lebak, James/The MathWorks|Fanous, Brian/The MathWorks|Moore, Nicholas/The MathWorks	2011	2011/txt/0945_Lebak_A.txt	http://www.ll.mit.edu/HPEC/agendas/proc11/Day2/Focus_3/0945_Lebak_A.pdf
541	Graphics Processor Clusters for High Speed Backpropagation	Campbell, Daniel/Georgia Tech Research Institute|Cook, Daniel/Georgia Tech Research Institute	2011	2011/txt/1015_Campbell_A.txt	http://www.ll.mit.edu/HPEC/agendas/proc11/Day2/Focus_3/1015_Campbell_A.pdf
542	Optimization of the Earth Mover's Distance Algorithm for a GPU-based Real-Time Multispectral Computer Vision System	Shaffer, Andrew/Applied Research Laboratory, Penn State University	2011	2011/txt/1100_Shaffer_A.txt	http://www.ll.mit.edu/HPEC/agendas/proc11/Day2/Focus_3/1100_Shaffer_A.pdf
543	Toward the Embedded Petascale Architecture: The Dual Roles of Middleware and Software Engineering in Future HPEC	Skjellum, Anthony/University of Alabama at Birmingham	2011	2011/txt/1130_Skjellum_A.txt	http://www.ll.mit.edu/HPEC/agendas/proc11/Day2/Session_3/1130_Skjellum_A.pdf
544	Android Application for Language Identification	Torres-Carrasquillo, Pedro A./MIT Lincoln Laboratory|Ford, Robert/MIT Lincoln Laboratory|Acevedo-Aviles, Joel/MIT Lincoln Laboratory	2011	2011/txt/1130_torres_A.txt	http://www.ll.mit.edu/HPEC/agendas/proc11/Day2/Focus_3/1130_torres_A.pdf
545	A 1024-core 70 GFLOP/W Floating Point Manycore Microprocessor	Olofsson, Andreas/Adapteva	2011	2011/txt/B-1_Olofsson_A.txt	http://www.ll.mit.edu/HPEC/agendas/proc11/Day2/Posters/B-1_Olofsson_A.pdf
546	Hardware Based Floating Point Processing	Parker, Michael/Altera Corporation|Cheung, Colman/Altera Corporation	2011	2011/txt/B-2_Parker_A.txt	http://www.ll.mit.edu/HPEC/agendas/proc11/Day2/Posters/B-2_Parker_A.pdf
547	A Reconfigurable Advanced Tamper Resistant Embedded Processing Platform	Fritz, Jason/Colorado Engineering Inc.|Bonato, Michael/Colorado Engineering Inc.|French, David/Colorado Engineering Inc.|Scally, Larry/Colorado Engineering Inc.	2011	2011/txt/B-3_fritz_A.txt	http://www.ll.mit.edu/HPEC/agendas/proc11/Day2/Posters/B-3_fritz_A.pdf
548	Optical Interconnects for Computing Applications	Fields, Mitchell/Avago Technologies	2011	2011/txt/B-4_Fields_A.txt	http://www.ll.mit.edu/HPEC/agendas/proc11/Day2/Posters/B-4_Fields_A.pdf
549	Implementation of 2DFFT Processing and Large Dense Matrix Multiply on the TMS320C6678 Processor	Lundgren, William/Gedae, Inc.|Barnes, Kerry/Gedae, Inc.|Steed, James/Gedae, Inc.|Friedmann, Amon/Texas Instruments|Rivera, Hector/Texas Instruments|Shim, Matteo/Olzetek, Inc.	2011	2011/txt/B-5_Lundgren_A.txt	http://www.ll.mit.edu/HPEC/agendas/proc11/Day2/Posters/B-5_Lundgren_A.pdf
550	VX Fabric: PCI-Express Switch Fabric for High Performance Embedded Computing	Negre, Robert/Kontron	2011	2011/txt/B-6_Negre_A.txt	http://www.ll.mit.edu/HPEC/agendas/proc11/Day2/Posters/B-6_Negre_A.pdf
551	COTS Based High Performance Radar and EW Development Platform	Taveniku, Mikael/XCube	2011	2011/txt/B-7_Taveniku_A.txt	http://www.ll.mit.edu/HPEC/agendas/proc11/Day2/Posters/B-7_Taveniku_A.pdf
552	Data Flow Compilation for Greater Parallelism	Mason, Jeff/CPU Technology|Bennett, Dave/CPU Technology|Ace, Tom/CPU Technology|Sudarsanam, Arvind/CPU Technology	2011	2011/txt/B-8_Mason_A.txt	http://www.ll.mit.edu/HPEC/agendas/proc11/Day2/Posters/B-8_Mason_A.pdf
553	The TILE-Gx Processor: Enabling HPC through Massive-Scale Manycore	Doud, Robert/Tilera	2011	2011/txt/B-9_Doud_A.txt	http://www.ll.mit.edu/HPEC/agendas/proc11/Day2/Posters/B-9_Doud_A.pdf
554	Performance Portable Tracking of Evolving Surfaces	Franchetti, Franz/Carnegie Melon University|Yu, Wei/Carnegie Melon University|Hoe, James C./Carnegie Melon University|Moura, Jose/Carnegie Melon University|Chen, Tsuhan/Cornell University	2011	2011/txt/1420_Franchetti_A.txt	http://www.ll.mit.edu/HPEC/agendas/proc11/Day2/Session_4/1420_Franchetti_A.pdf
555	3D Systems with On-Chip DRAM for Enabling Low-Power High-Performance Computing	Coskun, Ayse Kivilcim/Boston University|Meng, Jie/Boston University|Rossell, Daniel/Boston University	2011	2011/txt/1450_Coskun_A.txt	http://www.ll.mit.edu/HPEC/agendas/proc11/Day2/Session_4/1450_Coskun_A.pdf
556	Application-Specific Logic-in-Memory for Polar Format Synthetic Aperture Radar	Franchetti, Franz/Carnegie Mellon University|Zhu, Qiuling/Carnegie Mellon University|Turner, Eric/Carnegie Mellon University|Berger, Christian/Carnegie Mellon University|Pileggi, Larry/Carnegie Mellon University	2011	2011/txt/1520_Zhu_A.txt	http://www.ll.mit.edu/HPEC/agendas/proc11/Day2/Session_4/1520_Zhu_A.pdf
557	A third generation many-core processor for secure embedded computing systems	Irza, J./Coherent Logix, Inc., Andover, MA, USA|Doerr, M./Coherent Logix, Inc., Austin, TX, USA|Solka, M./Coherent Logix, Inc., Austin, TX, USA	2012	2012/txt/2012_6408657.txt	https://ieeexplore.ieee.org/document/6408657
558	Exploiting SPM-aware Scheduling on EPIC architectures for high-performance real-time systems	Liu, Yu/Dept. of ECE, Virginia Commonwealth Univ., Richmond, VA, USA|Zhang, Wei/Dept. of ECE, Virginia Commonwealth Univ., Richmond, VA, USA	2012	2012/txt/2012_6408658.txt	https://ieeexplore.ieee.org/document/6408658
559	High locality and increased intra-node parallelism for solving finite element models on GPUs by novel element-by-element implementation	Kiss, I./Budapest Univ. of Technol. & Econ., Budapest, Hungary|Badics, Z./Tensor Res., LLC, Andover, MA, USA|Gyimothy, S./Budapest Univ. of Technol. & Econ., Budapest, Hungary|Pavo, J./Budapest Univ. of Technol. & Econ., Budapest, Hungary	2012	2012/txt/2012_6408659.txt	https://ieeexplore.ieee.org/document/6408659
560	Accelerating fully homomorphic encryption using GPU	Wang, Wei/Dept. of Electr. & Comput. Eng., Worcester Polytech. Inst., Worcester, MA, USA|Hu, Yin/Dept. of Electr. & Comput. Eng., Worcester Polytech. Inst., Worcester, MA, USA|Chen, Lianmu/Dept. of Electr. & Comput. Eng., Worcester Polytech. Inst., Worcester, MA, USA|Huang, Xinming/Dept. of Electr. & Comput. Eng., Worcester Polytech. Inst., Worcester, MA, USA|Sunar, Berk/Dept. of Electr. & Comput. Eng., Worcester Polytech. Inst., Worcester, MA, USA	2012	2012/txt/2012_6408660.txt	https://ieeexplore.ieee.org/document/6408660
561	Use of CUDA for the Continuous Space Language Model	Thompson, E. A./Dept. of Eng., Purdue Univ. Fort Wayne, Fort Wayne, IN, USA|Anderson, Thomas/Human Performance Wing, Wright Patterson Air Force Base, Dayton, OH, USA	2012	2012/txt/2012_6408661.txt	https://ieeexplore.ieee.org/document/6408661
562	Graph programming model: An efficient approach for sensor signal processing	Kirsch, S./Raytheon Space & Airborne Syst., El Segundo, CA, USA	2012	2012/txt/2012_6408662.txt	https://ieeexplore.ieee.org/document/6408662
563	An application of the constraint programming to the design and operation of synthetic aperture radars	Holzrichter, M./Sandia Nat. Labs., Albuquerque, NM, USA	2012	2012/txt/2012_6408663.txt	https://ieeexplore.ieee.org/document/6408663
564	Fast functional simulation with a dynamic language	Steele, Craig S./Exogi LLC, Las Vegas, NV, USA|Bonn, J. P./Exogi LLC, Las Vegas, NV, USA	2012	2012/txt/2012_6408664.txt	https://ieeexplore.ieee.org/document/6408664
565	Synthetic Aperture Radar on low power multi-core Digital Signal Processor	Wang, Dan/Texas Instrum., Dallas, TX, USA|Ali, Murtaza/Texas Instrum., Dallas, TX, USA	2012	2012/txt/2012_6408665.txt	https://ieeexplore.ieee.org/document/6408665
566	Ruggedization of MXM graphics modules	Straznicky, I./Curtiss-Wright Controls Defense Solutions, Ottawa, ON, Canada	2012	2012/txt/2012_6408666.txt	https://ieeexplore.ieee.org/document/6408666
567	Parallel search of k-nearest neighbors with synchronous operations	Sismanis, N./Dept. of Electr. & Comput. Eng., Aristotle Univ., Thessaloniki, Greece|Pitsianis, Nikos/Dept. of Electr. & Comput. Eng., Aristotle Univ., Thessaloniki, Greece|Sun, Xiaobai/Dept. of Comput. Sci., Duke Univ., Durham, NC, USA	2012	2012/txt/2012_6408667.txt	https://ieeexplore.ieee.org/document/6408667
568	HPC-VMs: Virtual machines in high performance computing systems	Reuther, Albert/Comput. & Analytics Group, MIT Lincoln Lab., Lexington, MA, USA|Michaleas, Peter/Comput. & Analytics Group, MIT Lincoln Lab., Lexington, MA, USA|Prout, Andrew/Comput. & Analytics Group, MIT Lincoln Lab., Lexington, MA, USA|Kepner, Jeremy/Comput. & Analytics Group, MIT Lincoln Lab., Lexington, MA, USA	2012	2012/txt/2012_6408668.txt	https://ieeexplore.ieee.org/document/6408668
569	Multithreaded FPGA acceleration of DNA sequence mapping	Fernandez, E. B./Univ. of California Riverside, Riverside, CA, USA|Najjar, W. A./Univ. of California Riverside, Riverside, CA, USA|Lonardi, S./Univ. of California Riverside, Riverside, CA, USA|Villarreal, J./Jacquard Comput. Inc., Riverside, CA, USA	2012	2012/txt/2012_6408669.txt	https://ieeexplore.ieee.org/document/6408669
570	Large scale network situational awareness via 3D gaming technology	Hubbell, Matthew/MIT Lincoln Lab., Lexington, MA, USA|Kepner, Jeremy/MIT Lincoln Lab., Lexington, MA, USA	2012	2012/txt/2012_6408670.txt	https://ieeexplore.ieee.org/document/6408670
571	Scalable cryptographic authentication for high performance computing	Prout, Andrew/MIT Lincoln Lab., Lexington, MA, USA|Arcand, William/MIT Lincoln Lab., Lexington, MA, USA|Bestor, David/MIT Lincoln Lab., Lexington, MA, USA|Byun, Chansup/MIT Lincoln Lab., Lexington, MA, USA|Bergeron, Bill/MIT Lincoln Lab., Lexington, MA, USA|Hubbell, Matthew/MIT Lincoln Lab., Lexington, MA, USA|Kepner, Jeremy/MIT Lincoln Lab., Lexington, MA, USA|Michaleas, Peter/MIT Lincoln Lab., Lexington, MA, USA|Mullen, Julie/MIT Lincoln Lab., Lexington, MA, USA|Reuther, Albert/MIT Lincoln Lab., Lexington, MA, USA|Rosa, Antonio/MIT Lincoln Lab., Lexington, MA, USA	2012	2012/txt/2012_6408671.txt	https://ieeexplore.ieee.org/document/6408671
572	An update on SIPHER (Scalable Implementation of Primitives for Homomorphic EncRyption)  FPGA implementation using Simulink	Cousins, David Bruce/Raytheon BBN Technol., Georgia Inst. of Technol., Atlanta, GA, USA|Rohloff, Kurt/Raytheon BBN Technol., Georgia Inst. of Technol., Atlanta, GA, USA|Peikert, C./Raytheon BBN Technol., Georgia Inst. of Technol., Atlanta, GA, USA|Schantz, Richard/Raytheon BBN Technol., Georgia Inst. of Technol., Atlanta, GA, USA	2012	2012/txt/2012_6408672.txt	https://ieeexplore.ieee.org/document/6408672
573	Scrubbing optimization via availability prediction (SOAP) for reconfigurable space computing	Martin, Q./ECE Dept., Univ. of Florida, Gainesville, FL, USA|George, Alan D./ECE Dept., Univ. of Florida, Gainesville, FL, USA	2012	2012/txt/2012_6408673.txt	https://ieeexplore.ieee.org/document/6408673
